{
  "schema_version": "0.2.0",
  "ave_evidence_schema_version": "1.0.0",
  "export_id": "ln_80a14df9829e0a53",
  "created_at": "2026-09-22T21:19:53Z",
  "device": {
    "product": "Lumenate Nova",
    "app_package": "com.lumenate.lumenateaa",
    "app_version": "7.2.1",
    "app_version_code": 400,
    "firmware_version": "1.0.4"
  },
  "session": {
    "session_id": "offline-explore-partial-capture",
    "title": "Offline Explore",
    "duration_ms": 252459,
    "light_timeline_origin": {
      "clock_id": "optical-video-ms",
      "time_ms": 0,
      "definition": "Start of the physical measurement recording; not necessarily session-program zero.",
      "evidence_ids": [
        "ave_4f1d0e5ac6ea353e"
      ]
    },
    "audio_timeline_origin": null
  },
  "audio_asset": {
    "identity_status": "unavailable",
    "source_id": null,
    "role": null,
    "sha256": null,
    "duration_ms": null,
    "sample_rate_hz": null,
    "limitations": [
      "No verified audio asset is included in this partial physical-capture export."
    ]
  },
  "clocks": [
    {
      "clock_id": "optical-video-ms",
      "kind": "optical_measurement",
      "monotonic": true,
      "unit": "ms",
      "origin": "Start of the S21 recording.",
      "resolution_ms": 8.333333,
      "evidence_ids": [
        "ave_4f1d0e5ac6ea353e"
      ]
    }
  ],
  "segments": [
    {
      "segment_id": "offline-explore-measured-light-window",
      "start_ms": 64544,
      "end_ms": 249568,
      "execution_layer": "physical_measurement",
      "intensity": null,
      "color_rgb": null,
      "pulse": {
        "frequency_hz": null,
        "duty_cycle": null,
        "on_ms": null,
        "off_ms": null,
        "shape": "unknown",
        "shape_detail": "Variable flashing was detected; this summary segment does not assert a constant waveform."
      },
      "overlap_with_segment_ids": [],
      "command_ids": [],
      "evidence_ids": [
        "ave_4f1d0e5ac6ea353e"
      ]
    }
  ],
  "transitions": [],
  "commands": [],
  "sync_anchors": [],
  "provenance": {
    "source_hashes": [
      {
        "source_id": "offline-explore-s21-video",
        "sha256": "6314bc1142e08766dcc9ff6b134394e6811dad81843e899db9e9f721df407f6d"
      }
    ],
    "acquisition_notes": [
      "The A35 displayed Explore as the already-selected mask-resident preset before the run.",
      "The live app connection was disconnected before the operator started the preset with mask buttons.",
      "The nominal ten-minute preset was stopped after approximately 185 seconds of illuminated output.",
      "Raw video, Bluetooth logs, bugreports, identifiers, and copyrighted audio remain local-only."
    ]
  },
  "confidence": {
    "level": "L4",
    "score": 0.98,
    "method": "Direct four-region optical measurement, with simultaneous BLE confirmation where available."
  },
  "limitations": [
    "This is a partial empirical capture export, not a complete program reconstruction.",
    "No verified audio identity or cross-modal synchronization anchor is available.",
    "The camera cannot exclude phase differences shorter than one approximately 8.33 ms frame.",
    "No calibrated optical intensity or physical duty-cycle measurement was made."
  ],
  "ave_evidence": [
    {
      "schema_version": "1.0.0",
      "evidence_id": "ave_4f1d0e5ac6ea353e",
      "evidence_level": "measurement",
      "evidence_type": "four_emitter_optical_synchrony",
      "source_module": "lumenate_nova.optical_capture_export",
      "summary": "A 120 fps S21 recording measured synchronized output across all four Nova emitters during the captured Offline Explore interval.",
      "scope": {
        "channels": [
          "light-emitter-1",
          "light-emitter-2",
          "light-emitter-3",
          "light-emitter-4"
        ],
        "time_range_seconds": {
          "start": 0,
          "end": 252.459478
        }
      },
      "measurements": [
        {
          "name": "video_frame_rate",
          "value": 120,
          "unit": "frames/second"
        },
        {
          "name": "frame_count",
          "value": 30294,
          "unit": "count"
        },
        {
          "name": "emitter_1_rising_edges",
          "value": 1584,
          "unit": "count"
        },
        {
          "name": "emitter_2_rising_edges",
          "value": 1586,
          "unit": "count"
        },
        {
          "name": "emitter_3_rising_edges",
          "value": 1586,
          "unit": "count"
        },
        {
          "name": "emitter_4_rising_edges",
          "value": 1584,
          "unit": "count"
        },
        {
          "name": "same_frame_four_emitter_rising_edges",
          "value": 1563,
          "unit": "count"
        },
        {
          "name": "binary_disagreement_frames",
          "value": 35,
          "unit": "count"
        },
        {
          "name": "binary_disagreement_fraction",
          "value": 0.00116,
          "unit": "ratio"
        },
        {
          "name": "minimum_pairwise_luma_correlation",
          "value": 0.997801,
          "unit": "correlation"
        },
        {
          "name": "maximum_pairwise_luma_correlation",
          "value": 0.999953,
          "unit": "correlation"
        }
      ],
      "context": {
        "camera": "Samsung Galaxy S21 Ultra 5G",
        "resolution": "1920x1080",
        "classification": "50x50 core-region mean luma threshold sweep",
        "first_on_video_ms": 64544,
        "last_on_video_ms": 249568
      },
      "confidence": {
        "score": 0.98,
        "method": "Threshold-robust per-frame luma analysis of four spatially separate emitter cores."
      },
      "provenance": {
        "source_id": "offline-explore-s21-video",
        "input_sha256": "6314bc1142e08766dcc9ff6b134394e6811dad81843e899db9e9f721df407f6d"
      },
      "supporting_evidence_ids": [],
      "limitations": [
        "The approximately 8.33 ms frame interval cannot exclude subframe phase offsets.",
        "Camera exposures can miss narrow pulses between frames.",
        "The recording is not a calibrated intensity or duty-cycle measurement.",
        "The export describes only the recorded window, not unrecorded portions of the session."
      ]
    }
  ]
}
